{
  "$schema": "../../../schemas/skill/v1.json",
  "schemaVersion": 1,
  "id": "flower/plan-feature",
  "version": "1.0.1",
  "purpose": "Produce a bounded, risk-classified, and independently verifiable implementation plan for a Flower feature.",
  "entrypoint": "SKILL.md",
  "compatibleFlower": {
    "minimum": "0.1.0",
    "maximumExclusive": "0.2.0"
  },
  "adapters": ["codex", "claude"],
  "capabilities": {
    "reads": [
      ".flower/*.json",
      "README.md",
      "FLOWER_SPEC.md",
      "FLOWER_AGENTIC_SPEC.md",
      "docs/**/*.md",
      "packages/**",
      "schemas/**",
      "tests/**",
      ".git"
    ],
    "writes": [],
    "network": false,
    "externalEffects": [],
    "approvals": []
  },
  "provenance": {
    "kind": "first-party",
    "source": "flower-framework",
    "revision": "bundled:0.1.0",
    "author": "Flower maintainers",
    "license": "UNLICENSED"
  },
  "files": [
    {
      "path": "SKILL.md",
      "bytes": 3805,
      "digest": "sha256:eb142c7fa5bebfbcce157de471aa5ff1d6e0faebff2a2cbab8430bc2e6d14567"
    }
  ]
}
